{
  "event_id": "0190et-0004",
  "timestamp": "2026-10-15T14:30:00Z",
  "kind": "energytech.grid.transmission-switching-recommended",
  "source": "cgo-ems-prod",
  "asset_ref": {
    "scheme": "transmission-line-id-tokenized",
    "value": "tok_tx_CGO_line_138kv_north"
  },
  "resource": {
    "type": "transmission-switching-order",
    "id_tokenized": "tok_res_tx_d4",
    "bes_cyber_system_categorization": "HIGH-IMPACT",
    "ot_it_boundary": "OT"
  },
  "action": "recommend",
  "outcome": {
    "status": "success",
    "recommendation": "operator-confirmation-required"
  },
  "agent": {
    "ai_tool_card_url": "https://vendore-gridsense.example/.well-known/ai-tool-cards/gridsense-6.x.json",
    "ai_decision_card_url": "https://cgo.example/.well-known/decisions/CGO-DEC-2026-GRID-0117.json",
    "human_operator_session_id_tokenized": "tok_op_session_7e2",
    "human_operator_nerc_certification_id_tokenized": "tok_nerc_cert_9a01"
  },
  "regulatory_basis": [
    "nerc-cip-002-bes-categorization",
    "nerc-cip-007-system-security-management",
    "nerc-operating-procedures"
  ],
  "decision_card_ref": "https://cgo.example/.well-known/decisions/CGO-DEC-2026-GRID-0117.json",
  "prev_hash": "a06646564947b2892d1b91a7568c4bf87baccf0f32fa9ad1c53d3c1d93e07578",
  "hash": "0b1ec0b2962ad21ecbf2927363219be2a56f3b1f4341112a050916b30aeefe88"
}
